,subreddit,title,selftext,upvote_ratio,score
0,UCSC,"17 Months Later: After Laying Off Instructors, UCSC Has No Recreational Scuba Classes Offered, Despite Promising Courses Would Be Available in 2021","Instead Athletics and Recreation has posted [this announcement](https://recreation.ucsc.edu/news/scuba-update-w22.html) claiming that classes are unable to be offered due to ""the Covid-19 pandemic...human resource processes, supply chain logistics, dive locker inspection approvals, and required staff certifications"".

Athletics and Recreation Director Sue Harriman [asserted in Dec 2020 after announcing the layoffs](https://www.cityonahillpress.com/2020/12/10/recreational-and-p-e-instructors-face-permanent-layoffs/) ""SCUBA...and other recreational programs will not be cut and will continue to be offered in the coming academic year.""

In addition ""even with permanent staff layoffs, students will continue to pay fees associated with P.E. and recreation through Measures 32 and 64. Students pay a total of $12.50 per quarter in fees toward instruction and salaries."", so students are still paying for these courses which are no longer available. 

In the Spring Announcement the Athletics and Recreation Department states that ""local dive shops have been notified so they can prepare instruction for UCSC students with special consideration of your schedules and personal financial situations."" however before the layoffs UCSC offered SCUBA courses to students for free as a part of the above mentioned Measures.

Why are the programs you're still paying for unavailable? UCSC had one of the best scuba instruction programs in the state and now has no program, instead is forcing students to pay for outside instruction.",1.0,1.0
1,UCSC,CSE182,Has anyone taken CSE182 before? Does Professor Finkelstein curve the class?,1.0,1.0
2,UCSC,Structure Fire at Academic Resource Center (ARC),Everyone OK?,0.93,12.0
3,UCSC,Looking for a single room for next year,Hey! I'm going to be a junior next year and am looking for a housing group that has a single available. And if you wanna ask me anything feel free to dm me :),1.0,2.0
4,UCSC,How to Find Roommates,"Hey everyone! I'm Anthony a 1st year CS:GD major/aspiring indie dev looking for roommates in porter apartments for the coming year, and was just wondering if there's any discord or other online communities best for looking for roommates to easily communicate with other than through the housing portal? Or even if there's just anyone in here that wants to talk lol, thanks!",1.0,1.0
5,UCSC,Looking to buy 2 commencement Tickets,"I’m looking to get two extra tickets so my whole family can come, I’m from John R Lewis but idk if it matters for the tickets. We can negotiate the price.",1.0,1.0
6,UCSC,Before and After of the goat 'fire prevention',,0.86,81.0
7,UCSC,iso local art (o_ _)ﾉ彡☆,"hey all\~ i’m looking to buy some local art (posters, paintings, jewelry, anything really!) if anyone knows a good resource, events, or specific ppl i can reach out to lmk!! :)) ♡",1.0,5.0
8,UCSC,How do I get into a piano music room?,If I just wanna play for an hour rn how do I go about getting to a piano on campus? I’ve heard about the music rooms in the music center but do I have to rent them?,1.0,1.0
9,UCSC,selling (1) dombresky ticket for tmr 05/07 at the catalyst lmkk,,0.33,0.0
10,UCSC,Selling 2 tickets to Dombresky @ the Catalyst Tomorrow May 7,"Two tickets for $60 (30 each) OBO

They go for $81.42 right now (($32 + $8.71 fee) x2).",0.67,1.0
11,UCSC,Rocky horror at the delmar,Anyone have an extra ticket for rocky horror tonight??,1.0,2.0
12,UCSC,Anyone have an extra rocky horror show ticket for tonight I could purchase? : ),,1.0,3.0
13,UCSC,Lost your skateboard on campus?,"Come see Lost and Found at the Student Health Center, we have it.",1.0,7.0
14,UCSC,Easy TA GE class over the summer?,,1.0,7.0
15,UCSC,Cut or Uncut?,,0.26,0.0
16,UCSC,Anyone going to EDC this year?,,0.6,1.0
17,UCSC,Do you need to pay to use the 35 bus or is student ID fine?,,1.0,3.0
18,UCSC,best hike for someone living on campus,looking for a beautiful hike to take a friend who’s visiting! i’ve only been through pogonip a little bit,1.0,12.0
19,UCSC,Handshake down?,"For some reason when I try to log into Handshake, it's saying ""Access to app.joinhandshake.com was denied You don't have authorization to view this page. HTTP ERROR 403"". Is anyone else having this problem, or can someone check on their end? I need a job yo

#",0.75,2.0
20,UCSC,"CSE 102, 115a, and 183 (REPOST: I accidentally wrote the wrong class in the last one :/)","How manageable would this course load be:

1. CSE 102 (w/ Tantalo)
2. CSE 115A (w/ Jullig)
3. CSE 183 (w/ Harrison)

I'm also considering swapping either 115 or 180 out with CSE 120 or CSE 180 (w/ Finkelstein). Any help would be appreciated!",0.75,2.0
21,UCSC,Withdrawing from a class,Is the class withdraw deadline 11:59 PM PT tomorrow night? or is it by May 6th.,1.0,2.0
22,UCSC,who stole what?,,0.99,99.0
23,UCSC,Food Deliveries On-Campus,"I just saw a man limping (a bit) walking around Kresge for awhile. Who seemed to be looking to deliver food. Be really specific with your directions. Have some compassion. You know how difficult it is to walk around on campus. 
You can always meet your drivers half-way or have them call you for more specific directions.",1.0,70.0
24,UCSC,ILC vs Stevenson apartments,My housing application got accepted for both the ILC &amp; Stevenson apartments for my sophomore year in 2022-2023. Pros &amp; cons of either? Are the Stevenson apartments really much nicer than other on campus apartments? I only have a couple days to decide. Thanks.,1.0,3.0
25,UCSC,Roommate groups,"If I join a roommate group, could the leader of that group assign the members to different apartments/dorms or would we have to all be in the same apartment/dorm room?",0.91,8.0
26,UCSC,room selection appointment times,hey y’all. does anyone know what the earliest room selection appointment time is? like what time in the morning does it start? i just wanna weigh my chances lol thanks :),1.0,11.0
27,UCSC,baby squirrels at porter!,,0.99,105.0
28,UCSC,"Currently a CC student with a 3.4 gpa business major, what’s the probability of me getting in, I saw the sheet on the UC page that the acceptance range is like 3.19-3.7 for the major, something like that, but I’m unsure if I’ll get accepted, help pls???",,0.5,0.0
29,UCSC,Bible Study people,Got approached by a girl outside McHenry and she started talking about her bible study group and I immediately responded with  “I’m atheist”. Thanks to whoever has posted about them on here!,0.95,104.0
30,UCSC,How To Find Porter Apartments Roommates,"Hey y'all! I'm Anthony a 1st year CS:GD major/aspiring indie dev looking for roommates in porter apartments for the coming year, and was just wondering if there's any discord or other online communities best for looking for roommates to easily communicate with other than through the housing portal? Or even if there's just anyone in here that wants to talk lol, thanks!",0.63,2.0
31,UCSC,any 2026 computer science BS majors here?,Just wanna say hi to my fellow future peers!,0.67,3.0
32,UCSC,Housing group,"Hello peeps! I’m a female biology major affiliated with Porter. I’m also in EOP. I’m quiet and like to read, watch anime and listen to music. I’m also really clean lol So if anyone wants to form a group for the Porter apartment please let me know. I don’t really know how this works since this is the first time I’ve done this but I got an email today. 
Thank you!!",0.8,3.0
33,UCSC,Has anyone found a black jansport backpack?,"I lost my backpack on tuesday and only just noticed and don’t know where it might be besides the dining halls. The backpack is an all black jansport, with drumsticks and purple notebook in the bigger pocket. If you’ve seen it, please let me know!",0.78,5.0
34,UCSC,"Whoever drew this at the Baskin perks, thank you 🧡",,1.0,220.0
35,UCSC,Does anyone have extra Merrill commencement tickets?,Will definitely buy them off you if you have extra. Unfortunately the allotted 6 tickets will not cover all of my family members. PM me if you’re down and we can discuss pricing!! Thanks in advance :),0.67,1.0
36,UCSC,Yasmin M Kresge Affiliate We Found Your Wallet,"Please contact me I work in downtown and, we found your wallet at work and have put it somewhere safe!",0.58,2.0
37,UCSC,porter apartments?!,"i’m moving into the porter apartments in the fall, but wanted to know if there’s a difference between the buildings? is there a building better than the others or something to avoid? literally anything about the apartment would be helpful :D",0.67,2.0
38,UCSC,Merrill apartments layouts,is the only option 2 singles 1 triple?,0.75,2.0
39,UCSC,Pokémon go?,Anybody know how I can join big raids at Ucsc?? Are there any pages or groups?,0.75,4.0
40,UCSC,I'll Make You a New Short-Form Music Playlist! 🎵,"Hi guys!

I was doing some research on Music Discovery, and I found that people's main complaint is that it takes too long to find new music you love.

This was the core insight that led me to develop a new way to recommend + shorten music/podcasts and I'd love to test it out now. 

If you'd like I can email over a sample 1 minute playlist (just provide your favorite genre+1 song) using the shortening algorithm to test out.

Sign up for the waitlist below if you are interested and I'd love any comments/criticisms :)

[https://forms.gle/W7BxeY1s39andTPB7](https://forms.gle/W7BxeY1s39andTPB7)",0.57,1.0
41,UCSC,where are the goats now?,the left college nine and i really want to see them!,1.0,36.0
42,UCSC,Commencement Tickets,So are commencement tickets actually transferrable or should I save my money?,1.0,2.0
43,UCSC,Which advising?,"I want to change my major to cog sci, but I have to do the 4-year plans as well. So, do I go to college advising to change my major? or does major advising take care of all that?",1.0,3.0
44,UCSC,Field closed sign,Remember when the field closed sign got stolen and put in different places around campus? Yea let’s bring it back,0.95,54.0
45,UCSC,what’s the chance i get housing if i fill out the housing application now,"i’m a sophomore this fall and my parents suddenly wanted me to live on campus, and i just applied on the housing portal, but idk what my chances are of even getting housing are",0.93,12.0
46,UCSC,EOP?,"I was also wondering if EOP decisions already came out for incoming freshmen? I believe I fall under the category to be in EOP, but I don't see the support group in my student center profile. Have the decisions come out, and if so should I appeal to get in? I also was wondering what programs I should opt into; are there any that really do benefit, and any clubs that are just good to be in?",0.81,6.0
47,UCSC,Is there a place that I can refill my water bottle in Oakes?,,0.67,1.0
48,UCSC,sr requirement over summer,"my options are LALS 15, STAT 5, and PSYC 2. anyone have any opinions on these courses or suggest one of these over the other to fulfill the SR ge this summer? ty!",0.75,2.0
49,UCSC,doc marten wearers,i have a pair i wear everyday. parents want me to get hiking boots or sneakers for school. will I be fine with my docs??? theyve never given me blisters and i dont feel like getting new shoes lol,0.9,34.0
50,UCSC,Dual Enrollment credits,"Hey so im an incoming freshman to Santa Cruz, and this current senior year, I have been taking college classes at my local community college as well as being enrolled in high school. I have taken an English 1a, a social media elective class, and I plan to take an intermission philosophy 1 class. I'm wondering how I would transfer this credit, and what would this help me for exactly? I'm not sure what I want to major in but I'm considering double majoring in business and physics. Something like that lol, I keep changing from physics, to bio, to neuroscience, and psychology. Im not sure but we'll seeeeee",0.66,1.0
51,UCSC,Looking for 2 housemates for next school year,"Hi there, me and my housemates(3 male) are looking for 2 people to renew our lease with us. The house is a 3 bedroom and 2.5 bath. Rent is $820 per person and util averages to about $80-100 per person. Its a 5 minute walk to a 18/20 bustops on mission.  Please let me know if you are interested and I can tell you more information about it.",0.78,5.0
52,UCSC,Up and Up Dombresky rave this saturday 5/07,i have 2 tickets to the rave at the catalyst this saturday and I won't be able to go because my friend and I are both scheduled to work. trying to sell my tix for $40 each PM me if you're interested!! I think they're around $60 now,0.75,2.0
53,UCSC,Crown dining hall finally found the forbidden pizza slicing strategy,,1.0,200.0
54,UCSC,Double major art and psychology,"I’m an incoming freshman and I’m thinking about double majoring in art and psychology. I want to start my own art therapy business someday, and I’m very passionate about both fields of study. I’m a little worried though that it might not be realistic for me to double major while also balancing a social life and extracurricular activities like sports and clubs. Any advice would be useful, thanks.",1.0,9.0
55,UCSC,free magazines on campus?,"I have an art project due for my midterm and was wanting to use some magazines, is there anywhere on campus that may provide this and/or other art supplies?",0.83,4.0
56,UCSC,Summer Session 2 easy classes,Any easy A classes during summer session 2? Little reading/writing courses preferred,0.6,1.0
57,UCSC,how would you transfer credit from a class you take at a cc back to here?,,0.67,1.0
58,UCSC,Help with taking community college classes,Hi I was wondering if anyone has experience with taking CC classes over the summer. I want to take a gen ed class over the summer instead of paying UC tuition and was wondering what the process was like.,1.0,11.0
59,UCSC,looking for 2 people to fill a studio!,"My housing group is applying for house with a separate housing unit and we’re looking for 2 people to fill it.  It’s a studio that is detached from the main house but we’d still share a yard. Since the studio has its own bathroom and kitchen space, rent would be $925 each not including utilities which would be split among 8 people so it wouldn’t be too much. The house is located in the Westside, close to Safeway and New Leaf, walking distance to a busy stop, a couple blocks from the beach and a 10 minute drive to campus. We’re looking to fill these spots ASAP so PM me if you’re interested!",0.67,2.0
60,UCSC,Selling Up&amp;UP ticket,"I got covid and cant go to the  Dombresky show, I wanted to sell my ticket, if you're interested DM me. I think the current price is 40$, ill do 10$ below MSRP.",0.5,0.0
61,UCSC,Selling tickets for the Pharcyde and Dombresky @ the Catalyst,"I just got covid and unfortunately cannot go to these shows - The Pharcyde is tomorrow night and the Dombresky show is on Saturday night, both at the catalyst. Imma be selling each of my tickets at a lil discount if anyone is interested. I’ll take $35 for Dombresky and $27 for the Pharcyde tickets. Pm if interested !",0.6,1.0
62,UCSC,FSH waitlist for a childless couple?,"I am an incoming grad student and we submitted our application in late April. As a childless couple, how long should we expect to wait?",0.9,8.0
63,UCSC,UCSC or UCD Biochemistry program,"So I got accepted to both Santa Cruz and Davis as a transfer and was wondering if there was anyone in SC that can tell me how the biochemistry program is like? I know Davis is really well known for their research but I know I would like the SC environment more (I don't mind the plains but I do like forest and beaches more) I was wondering if I would find as many opportunities with research and experience in SC. 
A lot of people want me to go to Davis because of their reputation but I do have friends in SC that are in a similar major. I think both campuses still look nice but it's still a hard decision.
Any advice or opinions to help me decide would really help!",1.0,3.0
64,UCSC,I'll Make a New Short-Form Music playlist For You 🎵,"Hi guys!

I was doing some research on Music Discovery, and I found that people's main complaint is that it takes too long to find new music you love or it takes a long time to sift through all of the boring music before finding a gem.

This was the core insight that led me to start developing a new way to shorten music.

If you'd like I can email over a sample playlist (just provide your favorite genre+2 songs) using the shortening algorithm to test out.

Sign up for the waitlist below if you are interested and I'd love any comments/criticisms :)

[https://forms.gle/W7BxeY1s39andTPB7](https://forms.gle/W7BxeY1s39andTPB7)",0.75,4.0
65,UCSC,Off campus housing - Does anyone know how Places4Students works? Every time I try to log in w my Cruz id it displays an error message. Side note: Any roommate group chats/ discords?,,1.0,2.0
66,UCSC,Anyone get off the waitlist yet?,"Would love to hear from anyone who may have gotten off the UCSC waitlist for 2022 freshmen admission.
Thanks",1.0,6.0
